title,pubDate,guid,link,description
Teamsters: A sleeping American giant now spoiling for a fight,"Wed, 23 Mar 2022 00:15:29 GMT",https://www.bbc.co.uk/news/world-us-canada-60818241,https://www.bbc.co.uk/news/world-us-canada-60818241?at_medium=RSS&at_campaign=KARANGA,Teamsters were once known for Jimmy Hoffa and ties to the mob. Their new boss wants to take on Amazon.
When will free Covid tests end across the UK and can I buy LFTs?,"Tue, 22 Mar 2022 10:47:42 GMT",https://www.bbc.co.uk/news/health-51943612,https://www.bbc.co.uk/news/health-51943612?at_medium=RSS&at_campaign=KARANGA,"Most free Covid tests will soon be scrapped in England, but will remain in Scotland and Wales."
Oscars 2022: 18 bitesize facts about this year's nominees,"Wed, 23 Mar 2022 00:28:02 GMT",https://www.bbc.co.uk/news/entertainment-arts-59984120,https://www.bbc.co.uk/news/entertainment-arts-59984120?at_medium=RSS&at_campaign=KARANGA,A round-up of quirky facts and possible record breakers ahead of Sunday's Academy Awards.
Heat pumps: How do they work and how do I get one?,"Tue, 22 Mar 2022 11:38:31 GMT",https://www.bbc.co.uk/news/science-environment-57159056,https://www.bbc.co.uk/news/science-environment-57159056?at_medium=RSS&at_campaign=KARANGA,The government's grant support scheme for replacing gas boilers with heat pumps begins in April.
The Russians trapped on a Thai island as war rages in Ukraine,"Wed, 23 Mar 2022 00:18:58 GMT",https://www.bbc.co.uk/news/world-asia-60818869,https://www.bbc.co.uk/news/world-asia-60818869?at_medium=RSS&at_campaign=KARANGA,"Thousands of Russian and Ukrainian tourists are stuck in Phuket, unable to go home."
When and where can I ride an e-scooter legally?,"Tue, 22 Mar 2022 15:02:04 GMT",https://www.bbc.co.uk/news/uk-48106617,https://www.bbc.co.uk/news/uk-48106617?at_medium=RSS&at_campaign=KARANGA,London is the latest UK city to trial e-scooters - which the government hopes will be a more environmentally-friendly way to travel.
Coronavirus: Where does the government borrow billions from?,"Tue, 22 Mar 2022 14:41:58 GMT",https://www.bbc.co.uk/news/business-50504151,https://www.bbc.co.uk/news/business-50504151?at_medium=RSS&at_campaign=KARANGA,"How does it work when a government wants to borrow money, and when does it have to pay it back?"
What are the UK's remaining Covid restrictions?,"Tue, 22 Mar 2022 13:18:20 GMT",https://www.bbc.co.uk/news/explainers-52530518,https://www.bbc.co.uk/news/explainers-52530518?at_medium=RSS&at_campaign=KARANGA,Almost all of the UK's Covid rules will have ended if Wales lifts restrictions as planned.
Liverpool and Manchester mayors want FA Cup semi-final switched from Wembley,"Tue, 22 Mar 2022 19:24:57 GMT",https://www.bbc.co.uk/sport/football/60842200,https://www.bbc.co.uk/sport/football/60842200?at_medium=RSS&at_campaign=KARANGA,"The FA Cup semi-final between Liverpool and Manchester City should be moved from Wembley, say the mayors of both cities."
Ricketts family offers to meet Chelsea fans amid criticism of potential ownership,"Tue, 22 Mar 2022 22:12:44 GMT",https://www.bbc.co.uk/sport/football/60830090,https://www.bbc.co.uk/sport/football/60830090?at_medium=RSS&at_campaign=KARANGA,"The Ricketts family, which is aiming to buy Chelsea, says it will meet fans to allay concerns about its potential ownership."
Rafael Nadal out for up to six weeks with rib injury,"Tue, 22 Mar 2022 15:13:43 GMT",https://www.bbc.co.uk/sport/tennis/60817261,https://www.bbc.co.uk/sport/tennis/60817261?at_medium=RSS&at_campaign=KARANGA,"Rafael Nadal is ruled out for between four and six weeks because of a stress fracture of the rib, with the French Open starting on 22 May."
Roy given suspended two-match ban and fine after ECB hearing,"Tue, 22 Mar 2022 16:26:54 GMT",https://www.bbc.co.uk/sport/cricket/60839423,https://www.bbc.co.uk/sport/cricket/60839423?at_medium=RSS&at_campaign=KARANGA,"England batter Jason Roy receives a suspended two-match international ban and is fined £2,500 following a disciplinary hearing."
Barca come from behind to beat Real and take Women's Champions League first-leg advantage,"Tue, 22 Mar 2022 22:00:19 GMT",https://www.bbc.co.uk/sport/football/60840604,https://www.bbc.co.uk/sport/football/60840604?at_medium=RSS&at_campaign=KARANGA,Barcelona score two late goals as they come from behind to beat rivals Real Madrid and take the first-leg advantage in their Champions League quarter-final tie.
Pogba's World Cup medal was stolen in burglary,"Tue, 22 Mar 2022 23:45:32 GMT",https://www.bbc.co.uk/sport/football/60843380,https://www.bbc.co.uk/sport/football/60843380?at_medium=RSS&at_campaign=KARANGA,Manchester United midfielder Paul Pogba says burglars stole his World Cup winner's medal when they broke into his home.
Chancellor Rishi Sunak to deliver Spring Statement amid price pressures,"Wed, 23 Mar 2022 00:24:44 GMT",https://www.bbc.co.uk/news/uk-politics-60838493,https://www.bbc.co.uk/news/uk-politics-60838493?at_medium=RSS&at_campaign=KARANGA,The chancellor will give his economic update to the Commons as the cost of living crisis continues.
How could the Chancellor's plans affect you?,"Mon, 21 Mar 2022 14:02:58 GMT",https://www.bbc.co.uk/news/business-60819205,https://www.bbc.co.uk/news/business-60819205?at_medium=RSS&at_campaign=KARANGA,The Ukraine war and rising living prices means Rishi Sunak faces pressure to take fresh action to help.
Cost of living: 'It feels like I'm being priced out of existence',"Tue, 22 Mar 2022 12:42:18 GMT",https://www.bbc.co.uk/news/uk-60820705,https://www.bbc.co.uk/news/uk-60820705?at_medium=RSS&at_campaign=KARANGA,Some disabled people say they are switching off their heating to cope with spiralling energy bills.
Cost of living: Calls for targeted help to cut energy bills,"Fri, 18 Mar 2022 22:42:40 GMT",https://www.bbc.co.uk/news/business-60796131,https://www.bbc.co.uk/news/business-60796131?at_medium=RSS&at_campaign=KARANGA,"Millions of people may have to spend less on food and clothing to afford higher bills, an energy boss says."
Spring Statement: Rishi Sunak seeks to combat cost-of-living squeeze,"Wed, 23 Mar 2022 23:05:03 GMT",https://www.bbc.co.uk/news/uk-politics-60848315,https://www.bbc.co.uk/news/uk-politics-60848315?at_medium=RSS&at_campaign=KARANGA,The chancellor cuts fuel duty and eases National Insurance rise but soaring prices threaten tough times.
Western leaders to unite for Ukraine,"Thu, 24 Mar 2022 04:31:13 GMT",https://www.bbc.co.uk/news/world-europe-60849917,https://www.bbc.co.uk/news/world-europe-60849917?at_medium=RSS&at_campaign=KARANGA,"President Joe Biden joins leaders of Nato, the EU and G7 in response to the invasion of Ukraine."
Prince William expresses 'profound sorrow' over slavery in Jamaica speech,"Thu, 24 Mar 2022 04:01:18 GMT",https://www.bbc.co.uk/news/uk-60856763,https://www.bbc.co.uk/news/uk-60856763?at_medium=RSS&at_campaign=KARANGA,"The Duke of Cambridge condemns the slave trade, saying it ""forever stains"" the UK's history."
Ashleigh Barty: Retiring world number one says 'wait and see' on plans,"Thu, 24 Mar 2022 05:43:39 GMT",https://www.bbc.co.uk/news/world-australia-60857013,https://www.bbc.co.uk/news/world-australia-60857013?at_medium=RSS&at_campaign=KARANGA,"World number one Ashleigh Barty tells people to ""wait and see"" about her next move following her shock retirement at the age of 25."
Ukraine war: Russian journalist Oksana Baulina killed in Kyiv shelling,"Wed, 23 Mar 2022 20:53:54 GMT",https://www.bbc.co.uk/news/world-europe-60855732,https://www.bbc.co.uk/news/world-europe-60855732?at_medium=RSS&at_campaign=KARANGA,Oksana Baulina died while filming destruction caused by Russian shelling in a Kyiv neighbourhood.
China plane crash: Human remains found amid wreckage,"Thu, 24 Mar 2022 03:54:16 GMT",https://www.bbc.co.uk/news/world-asia-china-60856854,https://www.bbc.co.uk/news/world-asia-china-60856854?at_medium=RSS&at_campaign=KARANGA,"The China Eastern plane was carrying 132 people, and there has been no sign of survivors so far."
Jeffrey Epstein's private islands put up for sale,"Thu, 24 Mar 2022 05:09:29 GMT",https://www.bbc.co.uk/news/business-60856925,https://www.bbc.co.uk/news/business-60856925?at_medium=RSS&at_campaign=KARANGA,The financier was accused of sexually abusing girls on one of the two Caribbean islands on sale.
Ukraine war: Fortnite owner Epic Games raises £37m for humanitarian efforts,"Thu, 24 Mar 2022 00:48:21 GMT",https://www.bbc.co.uk/news/technology-60850729,https://www.bbc.co.uk/news/technology-60850729?at_medium=RSS&at_campaign=KARANGA,"Video game developers, publishers and players come together to raise millions for Ukraine."
Madeleine Albright: First female US secretary of state dies,"Wed, 23 Mar 2022 21:04:19 GMT",https://www.bbc.co.uk/news/world-us-canada-60855139,https://www.bbc.co.uk/news/world-us-canada-60855139?at_medium=RSS&at_campaign=KARANGA,Tributes are paid to the Czech immigrant who was the first woman to become the top US diplomat.
Doubt over PM claim that P&O sackings may be illegal,"Wed, 23 Mar 2022 20:46:00 GMT",https://www.bbc.co.uk/news/business-60849957,https://www.bbc.co.uk/news/business-60849957?at_medium=RSS&at_campaign=KARANGA,There is doubt over a Boris Johnson claim that P&O Ferries may have broken a law by sacking 800 staff suddenly.
"Boris Becker offered his wedding ring to pay debts, court told","Wed, 23 Mar 2022 16:50:20 GMT",https://www.bbc.co.uk/news/uk-60847940,https://www.bbc.co.uk/news/uk-60847940?at_medium=RSS&at_campaign=KARANGA,"The former tennis star, who was declared bankrupt in 2017, is accused of failing to hand over assets."
Julian Assange: Wikileaks founder gets married in Belmarsh prison,"Wed, 23 Mar 2022 17:46:35 GMT",https://www.bbc.co.uk/news/uk-60852832,https://www.bbc.co.uk/news/uk-60852832?at_medium=RSS&at_campaign=KARANGA,The Wikileaks founder is being held in the high-security prison while the US seeks to extradite him.
"Orchards vanishing from the landscape, says National Trust","Thu, 24 Mar 2022 00:50:24 GMT",https://www.bbc.co.uk/news/science-environment-60834796,https://www.bbc.co.uk/news/science-environment-60834796?at_medium=RSS&at_campaign=KARANGA,"Orchards are in big decline, with an area the size of the Isle of Wight lost since 1900, research finds."
Ukraine war: BBC World Service granted extra funding,"Wed, 23 Mar 2022 22:44:17 GMT",https://www.bbc.co.uk/news/uk-60852833,https://www.bbc.co.uk/news/uk-60852833?at_medium=RSS&at_campaign=KARANGA,The government grants more than £4m to the World Service to help fight Russian disinformation.
How Rishi Sunak's Spring Statement will affect you,"Wed, 23 Mar 2022 15:35:00 GMT",https://www.bbc.co.uk/news/business-60819205,https://www.bbc.co.uk/news/business-60819205?at_medium=RSS&at_campaign=KARANGA,"Surging prices, National Insurance changes and fuel duty cuts - the impact on your finances explained."
How much is fuel duty and what will the cut on petrol save you?,"Wed, 23 Mar 2022 14:03:27 GMT",https://www.bbc.co.uk/news/business-52188448,https://www.bbc.co.uk/news/business-52188448?at_medium=RSS&at_campaign=KARANGA,UK fuel prices are at record highs and there are calls for the government to act.
Spring Statement: Key points at a glance,"Wed, 23 Mar 2022 18:31:51 GMT",https://www.bbc.co.uk/news/business-60849054,https://www.bbc.co.uk/news/business-60849054?at_medium=RSS&at_campaign=KARANGA,The chancellor laid out his Spring Statement amid a cost of living squeeze. Here's what you should know.
BBC editors react to Sunak's 2022 Spring Statement,"Wed, 23 Mar 2022 15:00:20 GMT",https://www.bbc.co.uk/news/uk-politics-60838862,https://www.bbc.co.uk/news/uk-politics-60838862?at_medium=RSS&at_campaign=KARANGA,"Laura Kuenssberg, Faisal Islam and Simon Jack review the headlines and reaction to the chancellor's update on the UK economy."
People face biggest drop in living standards since 1956,"Wed, 23 Mar 2022 18:21:18 GMT",https://www.bbc.co.uk/news/business-60846951,https://www.bbc.co.uk/news/business-60846951?at_medium=RSS&at_campaign=KARANGA,"Wages will lag soaring prices meaning the biggest drop in standards since 1956, says the OBR."
What is the UK's inflation rate and why is the cost of living going up?,"Wed, 23 Mar 2022 17:40:17 GMT",https://www.bbc.co.uk/news/business-12196322,https://www.bbc.co.uk/news/business-12196322?at_medium=RSS&at_campaign=KARANGA,UK inflation is rising at its fastest rate for 30 years and the government's forecaster predicts it could climb to a 40-year high.
Is Rishi Sunak a tax-cutter?,"Wed, 23 Mar 2022 01:55:02 GMT",https://www.bbc.co.uk/news/uk-politics-60840031,https://www.bbc.co.uk/news/uk-politics-60840031?at_medium=RSS&at_campaign=KARANGA,The chancellor says he wants to cut taxes - but figures show how taxes have risen under his watch.
The Papers: 'No heat to eat' as 'Sunak told: slash more taxes',"Wed, 23 Mar 2022 23:24:23 GMT",https://www.bbc.co.uk/news/blogs-the-papers-60856333,https://www.bbc.co.uk/news/blogs-the-papers-60856333?at_medium=RSS&at_campaign=KARANGA,Thursday's front pages respond to Chancellor Rishi Sunak's Spring Statement.
Small business owners: 'We're taking the hit',"Thu, 24 Mar 2022 00:18:12 GMT",https://www.bbc.co.uk/news/business-60852962,https://www.bbc.co.uk/news/business-60852962?at_medium=RSS&at_campaign=KARANGA,Many entrepreneurs are struggling to balance soaring costs and keep their businesses profitable.
War in Ukraine: 'Pets are getting left at train stations',"Wed, 23 Mar 2022 10:27:59 GMT",https://www.bbc.co.uk/news/world-europe-60848142,https://www.bbc.co.uk/news/world-europe-60848142?at_medium=RSS&at_campaign=KARANGA,A photographer from the UK travels to western Ukraine to rescue pets displaced by war.
"Plans for giant, lit-up dome approved for Olympics site","Wed, 23 Mar 2022 15:10:18 GMT",https://www.bbc.co.uk/news/uk-england-london-60848732,https://www.bbc.co.uk/news/uk-england-london-60848732?at_medium=RSS&at_campaign=KARANGA,The controversial sphere will be covered in lights and become one of London's biggest music venues.
Spring Statement: One family's cost of living experience,"Wed, 23 Mar 2022 18:15:15 GMT",https://www.bbc.co.uk/news/uk-60855084,https://www.bbc.co.uk/news/uk-60855084?at_medium=RSS&at_campaign=KARANGA,"The Fords are a busy family and, like many, they’ve noticed the impact of rising prices."
Goldman Sachs boss David Solomon set to DJ Lollapalooza,"Thu, 24 Mar 2022 01:26:47 GMT",https://www.bbc.co.uk/news/business-60854153,https://www.bbc.co.uk/news/business-60854153?at_medium=RSS&at_campaign=KARANGA,US investment banker David Solomon will play Lollapalooza in Chicago alongside acts like Metallica.
Taliban schools U-turn 'a devastating day' for Afghan girls - Malala Yousafzai,"Wed, 23 Mar 2022 17:24:33 GMT",https://www.bbc.co.uk/news/world-asia-60853162,https://www.bbc.co.uk/news/world-asia-60853162?at_medium=RSS&at_campaign=KARANGA,"The Taliban’s U-turn on girls' high schools is heartbreaking, the Nobel Peace Prize laureate says."
'I was shocked to find out I now have four kidneys',"Wed, 23 Mar 2022 06:12:57 GMT",https://www.bbc.co.uk/news/uk-scotland-edinburgh-east-fife-60823397,https://www.bbc.co.uk/news/uk-scotland-edinburgh-east-fife-60823397?at_medium=RSS&at_campaign=KARANGA,Transplant patient Stuart Middleton has both his kidneys - along with two he received from donors.
Ash Barty: Australians react to world tennis number one's shock retirement,"Wed, 23 Mar 2022 15:39:12 GMT",https://www.bbc.co.uk/news/world-australia-60850780,https://www.bbc.co.uk/news/world-australia-60850780?at_medium=RSS&at_campaign=KARANGA,"The BBC hears from tennis players in Brisbane, where world number one Ashleigh Barty regular trained."
William Collins: Giant memorial built without permission,"Tue, 22 Mar 2022 18:13:53 GMT",https://www.bbc.co.uk/news/uk-england-south-yorkshire-60838880,https://www.bbc.co.uk/news/uk-england-south-yorkshire-60838880?at_medium=RSS&at_campaign=KARANGA,The huge marble tribute in Sheffield has become a minor attraction - but its future is in doubt.
"Life of Madeleine Albright, the Czech-born US political trailblazer","Wed, 23 Mar 2022 18:56:24 GMT",https://www.bbc.co.uk/news/world-us-canada-48401172,https://www.bbc.co.uk/news/world-us-canada-48401172?at_medium=RSS&at_campaign=KARANGA,"Originally born in Czechoslovakia, Albright became a trailblazer for women on the world stage."
Oscars 2022: Which film might be named fan favourite?,"Thu, 24 Mar 2022 00:04:39 GMT",https://www.bbc.co.uk/news/entertainment-arts-60764010,https://www.bbc.co.uk/news/entertainment-arts-60764010?at_medium=RSS&at_campaign=KARANGA,"Cinderella, Minamata and Sing 2 might not be nominated, but they could be named ""fan favourite""."
Covid boosters: Who is being vaccinated?,"Mon, 21 Mar 2022 10:35:32 GMT",https://www.bbc.co.uk/news/health-55045639,https://www.bbc.co.uk/news/health-55045639?at_medium=RSS&at_campaign=KARANGA,Over-75s and those with a weakened immune system will be offered an extra booster dose this spring.
My Job: 'Covid has made it impossible to switch off',"Thu, 24 Mar 2022 00:14:47 GMT",https://www.bbc.co.uk/news/business-60654969,https://www.bbc.co.uk/news/business-60654969?at_medium=RSS&at_campaign=KARANGA,Ed Kendall qualified as a social worker in 2019 and has started a role focusing on safeguarding.
"Zimbabwe by-elections: New party, same fears of dirty tricks","Thu, 24 Mar 2022 00:06:24 GMT",https://www.bbc.co.uk/news/world-africa-60848482,https://www.bbc.co.uk/news/world-africa-60848482?at_medium=RSS&at_campaign=KARANGA,A host of by-elections present a key test for the new opposition and the country's democratic credentials.
Refugees: 'Rebuilding our life after home was bombed',"Thu, 24 Mar 2022 06:01:11 GMT",https://www.bbc.co.uk/news/uk-wales-60820974,https://www.bbc.co.uk/news/uk-wales-60820974?at_medium=RSS&at_campaign=KARANGA,The family house was destroyed and they lived in a tent but now they've settled in rural Wales.
Covid-19 in the UK: How many coronavirus cases are there in my area?,"Wed, 23 Mar 2022 17:54:44 GMT",https://www.bbc.co.uk/news/uk-51768274,https://www.bbc.co.uk/news/uk-51768274?at_medium=RSS&at_campaign=KARANGA,Explore the data on coronavirus in the UK and find out how many cases there are in your area.
England crush Pakistan at World Cup to move towards semis,"Thu, 24 Mar 2022 05:57:07 GMT",https://www.bbc.co.uk/sport/cricket/60844501,https://www.bbc.co.uk/sport/cricket/60844501?at_medium=RSS&at_campaign=KARANGA,Impressive England sweep aside Pakistan to move closer to a place in the semi-finals of the Women's World Cup.
Eidevall '100% sure' Arsenal will advance after first-leg draw,"Wed, 23 Mar 2022 23:31:08 GMT",https://www.bbc.co.uk/sport/football/60855875,https://www.bbc.co.uk/sport/football/60855875?at_medium=RSS&at_campaign=KARANGA,"Arsenal boss Jonas Eidevall says he is ""100% sure"" his team will progress into the semi-finals of the Women's Champions League."
Chelsea: Club allowed to sell tickets after government alters licence,"Wed, 23 Mar 2022 21:27:21 GMT",https://www.bbc.co.uk/sport/football/60853090,https://www.bbc.co.uk/sport/football/60853090?at_medium=RSS&at_campaign=KARANGA,Chelsea are allowed to sell tickets to some games again after the UK government altered the club's licence.
Ashleigh Barty retires: Her time at the top was too short for tennis - but not for her,"Wed, 23 Mar 2022 15:54:43 GMT",https://www.bbc.co.uk/sport/tennis/60853082,https://www.bbc.co.uk/sport/tennis/60853082?at_medium=RSS&at_campaign=KARANGA,BBC tennis correspondent Russell Fuller looks at the world number one's shock decision to retire.
England captain Kane keen to 'shine a light' on Qatar issues,"Wed, 23 Mar 2022 19:32:37 GMT",https://www.bbc.co.uk/sport/football/60852693,https://www.bbc.co.uk/sport/football/60852693?at_medium=RSS&at_campaign=KARANGA,"England captain Harry Kane says he wants to ""shine a light"" on issues around Qatar, where the 2022 World Cup will be held."
"World Cup 'hurt' driving Wales for play-offs, says Bale","Wed, 23 Mar 2022 18:49:36 GMT",https://www.bbc.co.uk/sport/football/60775091,https://www.bbc.co.uk/sport/football/60775091?at_medium=RSS&at_campaign=KARANGA,"Wales will use the ""hurt"" of previous near misses as inspiration for Thursday's World Cup play-off semi-final against Austria, says captain Gareth Bale."
Ukraine war: Destruction of cities shown from above,"Thu, 24 Mar 2022 00:06:23 GMT",https://www.bbc.co.uk/news/world-europe-60854503,https://www.bbc.co.uk/news/world-europe-60854503?at_medium=RSS&at_campaign=KARANGA,"In the month since Russia's military invaded, it has laid waste to cities across Ukraine."
Zelensky: How Ukraine's president uses addresses to set his agenda,"Thu, 24 Mar 2022 00:18:27 GMT",https://www.bbc.co.uk/news/world-europe-60855280,https://www.bbc.co.uk/news/world-europe-60855280?at_medium=RSS&at_campaign=KARANGA,In 10 parliaments over two weeks Ukraine's leader has used shame and national trauma to set a global agenda.
The Ukrainian refugee who loves to laugh at school in Poland,"Thu, 24 Mar 2022 00:09:35 GMT",https://www.bbc.co.uk/news/world-europe-60854502,https://www.bbc.co.uk/news/world-europe-60854502?at_medium=RSS&at_campaign=KARANGA,"Ten-year-old Yana started school in Poland three weeks ago, after fleeing the war in Ukraine."
What sanctions are being imposed on Russia over Ukraine invasion?,"Wed, 23 Mar 2022 11:16:56 GMT",https://www.bbc.co.uk/news/world-europe-60125659,https://www.bbc.co.uk/news/world-europe-60125659?at_medium=RSS&at_campaign=KARANGA,Western nations have imposed severe sanctions on Russia over its invasion of Ukraine.
A Kremlin adviser resigns and Ukrainian territory regained - Ukraine's latest war round-up,"Wed, 23 Mar 2022 21:30:51 GMT",https://www.bbc.co.uk/news/world-europe-60853547,https://www.bbc.co.uk/news/world-europe-60853547?at_medium=RSS&at_campaign=KARANGA,"Ukrainian forces are pushing back Russia's advances to Kyiv's west, as a Kremlin adviser resigns."
Ukraine's recruits swap spreadsheets for sniper rifles to defend Kyiv,"Tue, 22 Mar 2022 14:59:34 GMT",https://www.bbc.co.uk/news/world-europe-60831988,https://www.bbc.co.uk/news/world-europe-60831988?at_medium=RSS&at_campaign=KARANGA,"Preparing to defend Kyiv, Ukraine's new recruits must learn a new way of life - how to fight."
How many Ukrainians have fled their homes and where have they gone?,"Wed, 23 Mar 2022 15:36:16 GMT",https://www.bbc.co.uk/news/world-60555472,https://www.bbc.co.uk/news/world-60555472?at_medium=RSS&at_campaign=KARANGA,The UN says 10 million people have now fled their homes since the Russian invasion of Ukraine.
UK Covid infections climb by a million in a week,"Fri, 25 Mar 2022 12:39:21 GMT",https://www.bbc.co.uk/news/health-60872687,https://www.bbc.co.uk/news/health-60872687?at_medium=RSS&at_campaign=KARANGA,"About 4.3 million people - or one in every 16 - are thought to have the virus, compared to 3.3 million the week before."
PM backs calls for P&O Ferries boss Peter Hebblethwaite to resign,"Fri, 25 Mar 2022 15:40:04 GMT",https://www.bbc.co.uk/news/business-60872294,https://www.bbc.co.uk/news/business-60872294?at_medium=RSS&at_campaign=KARANGA,Boris Johnson backs Grant Shapps' call for Peter Hebblethwaite to quit after not consulting on sackings.
War in Ukraine: Estimated 300 dead in Mariupol theatre strike,"Fri, 25 Mar 2022 14:34:28 GMT",https://www.bbc.co.uk/news/world-europe-60873435,https://www.bbc.co.uk/news/world-europe-60873435?at_medium=RSS&at_campaign=KARANGA,The Mariupol attack reportedly caused the worst known loss of life in one strike since the invasion began.
Ukraine war: JK Rowling hits back at Putin's 'cancel culture' comment,"Fri, 25 Mar 2022 16:15:41 GMT",https://www.bbc.co.uk/news/world-europe-60878133,https://www.bbc.co.uk/news/world-europe-60878133?at_medium=RSS&at_campaign=KARANGA,"Mr Putin referenced the Harry Potter author during a speech condemning ""cancel culture"" in the West."
Kyrell Matthews: Mum and partner jailed for killing toddler son,"Fri, 25 Mar 2022 16:24:11 GMT",https://www.bbc.co.uk/news/uk-england-london-60866968,https://www.bbc.co.uk/news/uk-england-london-60866968?at_medium=RSS&at_campaign=KARANGA,"Kyrell Matthews suffered weeks of abuse before he died, much of it caught on harrowing recordings."
"David Amess killing: Ali Harbi Ali told police 'I done it, I killed an MP'","Fri, 25 Mar 2022 15:43:14 GMT",https://www.bbc.co.uk/news/uk-england-essex-60873662,https://www.bbc.co.uk/news/uk-england-essex-60873662?at_medium=RSS&at_campaign=KARANGA,The Old Bailey hears the man accused of killing Sir David Amess told police it was a terrorist attack.
EU signs US gas deal to curb reliance on Russia,"Fri, 25 Mar 2022 15:30:22 GMT",https://www.bbc.co.uk/news/business-60871601,https://www.bbc.co.uk/news/business-60871601?at_medium=RSS&at_campaign=KARANGA,The liquefied natural gas deal with US is part of EU attempts to reduce reliance on Russian energy.
"Ukraine: Nato will respond if Russia uses chemical weapons, warns Biden","Fri, 25 Mar 2022 05:23:43 GMT",https://www.bbc.co.uk/news/world-europe-60870771,https://www.bbc.co.uk/news/world-europe-60870771?at_medium=RSS&at_campaign=KARANGA,The US president made the comments during an unprecedented day of emergency summits in Brussels.
Manchester Arena attack: Mum wants right to register son’s death,"Fri, 25 Mar 2022 06:34:41 GMT",https://www.bbc.co.uk/news/uk-england-tyne-60859817,https://www.bbc.co.uk/news/uk-england-tyne-60859817?at_medium=RSS&at_campaign=KARANGA,"Caroline Curry called on the home secretary to ""look in her heart"" and change an ""antiquated"" law."
Bute Park: Three jailed for doctor's homophobic murder,"Fri, 25 Mar 2022 16:56:07 GMT",https://www.bbc.co.uk/news/uk-wales-60862833,https://www.bbc.co.uk/news/uk-wales-60862833?at_medium=RSS&at_campaign=KARANGA,"Dr Gary Jenkins, 54, died 16 days after he was attacked in Cardiff's Bute Park on 20 July 2021."
